{
  "$schema": "http://json-schema.org/draft-07/schema#",
  "$id": "https://github.com/jacky18008/pea-princess/blob/main/skills/vet-flat/references/verified-schema.json",
  "title": "vet-flat verified evidence",
  "description": "Part of Pea Princess (vet-flat) by Hsien Hao (Jacky) Chen - https://github.com/jacky18008/pea-princess - CC BY 4.0. The verifier's output in the role pipeline (references/pipeline.md): one verdict per evidence item, plus at most one round of things worth going back for. scripts/verify.py writes the deterministic half of this file on its own; the verifier model then reads only the items it flagged and may change a state, never invent an item. THE INTEGRATOR MAY USE NOTHING ELSE: an item that is not here, or is here as fail or unknown, is unknown in the report.",
  "type": "object",
  "additionalProperties": false,
  "required": ["schema", "items"],
  "properties": {
    "schema": {
      "type": "string",
      "const": "vet-flat/verified/1",
      "description": "Always the literal \"vet-flat/verified/1\"."
    },
    "case": {"type": ["string", "null"], "maxLength": 120},
    "checked_at": {
      "type": ["string", "null"],
      "description": "When the check ran, UTC, as 2026-09-06T11:20:00Z.",
      "pattern": "^[0-9]{4}-[0-9]{2}-[0-9]{2}T[0-9]{2}:[0-9]{2}(:[0-9]{2})?(Z|[+-][0-9]{2}:[0-9]{2})$"
    },
    "items": {
      "type": "array",
      "description": "One entry per evidence item, in the evidence file's order. An evidence item with no entry here has not been verified and counts as unknown.",
      "items": {"$ref": "#/definitions/verdict"}
    },
    "replan": {
      "type": "array",
      "description": "What is worth one more round of executor work, and nothing more. AT MOST ONE ROUND: if the second round still cannot get it, it is unknown and the report says so.",
      "items": {"$ref": "#/definitions/replan_item"}
    },
    "counts": {
      "type": "object",
      "description": "How many items landed in each state, plus the deterministic checks that ran.",
      "additionalProperties": true
    },
    "sufficiency": {
      "type": ["object", "null"],
      "description": "Bench only. The information-sufficiency probe: given this evidence and nothing else, is each known-good fact even derivable? Deterministic, no model, no tokens. It separates what the planner and executors failed to FETCH from what the integrator failed to USE.",
      "additionalProperties": true
    }
  },
  "definitions": {
    "verdict": {
      "type": "object",
      "additionalProperties": false,
      "required": ["id", "state"],
      "properties": {
        "id": {
          "type": "string",
          "description": "The evidence item's id.",
          "pattern": "^[A-Za-z0-9_.:-]{1,40}$"
        },
        "state": {
          "type": "string",
          "enum": ["pass", "fail", "unknown"],
          "description": "pass = the checks performed support using this claim with its original source class and qualifiers; retained-text quote checks may be unavailable (counts.quotes_unchecked). A quote match validates attribution, not factual truth, and pass never upgrades an estimate or proves a hard filter is met. fail = a check failed and reason says which. unknown = the executor could not get it, or the item could not be checked."
        },
        "reason": {
          "type": ["string", "null"],
          "description": "For fail and unknown: one plain sentence a reader could act on.",
          "maxLength": 400
        },
        "rules": {
          "type": "array",
          "description": "The deterministic rule ids that fired, for example \"quote_in_source\" or \"deposit_cap_branch\". Empty on a pass.",
          "items": {"type": "string", "minLength": 1, "maxLength": 60}
        },
        "checked_by": {
          "type": ["string", "null"],
          "description": "\"verify.py\" when the deterministic check settled it, or the role that changed it: \"verifier\". A state a model changed must say so.",
          "maxLength": 60
        }
      }
    },
    "replan_item": {
      "type": "object",
      "additionalProperties": false,
      "required": ["axis", "ask"],
      "properties": {
        "axis": {"type": "integer", "minimum": 1, "maximum": 12},
        "item": {
          "type": ["string", "null"],
          "description": "The evidence item this is about, when it is about one.",
          "maxLength": 40
        },
        "ask": {
          "type": "string",
          "description": "What the executor should do differently, concretely: the command with the right argument, the page to ask the user for.",
          "minLength": 1,
          "maxLength": 400
        },
        "round": {
          "type": "integer",
          "minimum": 1,
          "maximum": 1,
          "description": "Always 1. There is no second round."
        }
      }
    }
  }
}
